post_id,post_title,post_author,created_at,source
1qd8mzs,LIVE UPDATES | ICE-involved shooting in Minneapolis injures person; officer injured,kootles10,2026-01-15 03:30:47,reddit
1qd8l89,Secret Service agent assigned to JD Vance put on leave after sharing ‘sensitive details’ on fake date,Ralph--Hinkley,2026-01-15 03:28:29,reddit
1qd8bnt,"Federal Agent Shoots Immigrant in Minneapolis, Homeland Security Says",itsgoodpain,2026-01-15 03:16:03,reddit
1qd84h8,Trump admin pushes for pause in mask ban for federal agents,Trosterman,2026-01-15 03:06:46,reddit
1qd83au,"Trump administration rolls back $2 billion mental health, addiction grant cuts",becauseicansowhynot,2026-01-15 03:05:15,reddit
1qd7x1u,Federal officer shoots person in leg after being attacked during Minneapolis arrest,SnooGrapes2950,2026-01-15 02:57:35,reddit
1qd7vz1,Reports: Shooting involving federal law enforcement in north Minneapolis,Velvetrose-2,2026-01-15 02:56:19,reddit
1qd7ny5,3 More Lawmakers in Video Say Federal Prosecutors Are Investigating Them,ImAHoe4Glossier,2026-01-15 02:46:20,reddit
1qd7lnq,LIVE UPDATES | Minneapolis ICE shooting: Reports of another ICE-involved shooting,countraagh,2026-01-15 02:43:23,reddit
1qd7cwr,Virginia Democrats look to decimate GOP seats in redistricting effort,icey_sawg0034,2026-01-15 02:32:36,reddit
1qd768e,"White House reverses $2 billion cut to mental health, addiction grants.",FreshlyStarted,2026-01-15 02:24:16,reddit
1qd70rv,Opinion: Fix ‘qualified immunity’ to restore trust in police,ProjectMason,2026-01-15 02:17:22,reddit
1qd6qr9,She made a Facebook comment about her mayor. Then the police arrived.,PlethoraOfPinatass,2026-01-15 02:05:08,reddit
1qd6qi3,Trump administration cuts nearly 2 billion in funding for mental health and addiction,16ozbuddz,2026-01-15 02:04:50,reddit
1qd6n4l,Trump administration slashes funding for substance abuse and mental health programs nationwide,GeneReddit123,2026-01-15 02:00:38,reddit
1qd6j9o,US to suspend visa processing for 75 countries starting next week,Severe_County_5041,2026-01-15 01:55:52,reddit
1qd67cr,"White House post nods to racist, far-right subculture, extremism expert says | Image with question ‘Which way, Greenland man?’ is a ‘key concept in neo-Nazi and white supremacist subculture’",Hrmbee,2026-01-15 01:41:14,reddit
1qd658w,‘Fundamental disagreement’ in US-Greenland talks as Nato allies up military presence,my_vision_vivid,2026-01-15 01:38:39,reddit
1qd5xqk,US Senate kills resolution that would have limited Trump action in Venezuela,copaceticthoughts,2026-01-15 01:29:18,reddit
1qd5uqr,Denmark-US Rift Persists as NATO Nations Deploy to Greenland,SE_to_NW,2026-01-15 01:25:42,reddit
1qd5mpu,Dems Are Begging Their Own to Drop ‘Abolish ICE’,QueenMagik,2026-01-15 01:15:55,reddit
1qd5ghg,"Supreme Court Hacked, Proving Its Cybersecurity Is As Robust As Its Ethical Code",Adventurous_Row3305,2026-01-15 01:08:25,reddit
1qd5d2h,"In Blocking War Powers Resolution, GOP Senators Fail Yet Again to Stand Up to Authoritarianism",Large_banana_hammock,2026-01-15 01:04:12,reddit
1qd538a,"Key Republicans flip, kill effort to restrain Trump's policing power over Venezuela",kirby__000,2026-01-15 00:52:21,reddit
1qd50vf,"'Department of War' rebranding could cost as much as $125M, hundreds of millions more if it becomes legal name: CBO",Large_banana_hammock,2026-01-15 00:49:30,reddit
1qd4zuo,Trump Admin Accused of Adopting Hitler’s Nazi Propaganda | The contentious messaging has ramped up as tensions escalate across America in the wake of last week’s ICE shooting.,GirasoleDE,2026-01-15 00:48:17,reddit
1qd4vs0,Trump Cuts $2 Billion in Federal Funding for Mental Health and Substance Abuse Services,DTmann,2026-01-15 00:43:15,reddit
1qd4owh,US Senate blocks effort to rein in Trump's Venezuela war powers,Capable_Salt_SD,2026-01-15 00:35:07,reddit
1qd4l4z,Rep. Fine to Newsmax: Bill Empowers Trump to Annex Greenland,Large_banana_hammock,2026-01-15 00:30:34,reddit
1qd4iyn,How far will Europe go to defend Greenland from Trump?,OtherwiseCanary8971,2026-01-15 00:28:02,reddit
1qd4en9,Trump signs bill returning whole milk to US school lunches,fungobat,2026-01-15 00:22:55,reddit
1qd4ch1,Lindsey Graham calls DNC head 'worthless piece of crap',Crossstoney,2026-01-15 00:20:18,reddit
1qd48sa,Vance casts tiebreaking vote to kill Venezuela war powers resolution,IWantPizza555,2026-01-15 00:16:00,reddit
1qd46v0,Minneapolis mayor: ‘I don’t support abolishing ICE’,someopinionthatsr,2026-01-15 00:13:46,reddit
1qd4243,Trump says Iran has stopped killings as U.S. weighs military options,Publius015,2026-01-15 00:08:13,reddit
1qd40e8,Republican Senator Writes About Lindsey Graham’s Vomit in Fish Tank,Crossstoney,2026-01-15 00:06:15,reddit
1qd3x9j,Senate Republicans derail effort to rebuke Trump on Venezuela,Dry-Stain,2026-01-15 00:02:34,reddit
1qd3ouw,"EU-US relationship is ‘disintegrating,’ says Germany’s vice chancellor",Doener23,2026-01-14 23:53:11,reddit
1qd3lze,Senate Republicans defeat Venezuela war powers resolution as Trump pressures 2 GOP senators to flip,SpaceElevatorMusic,2026-01-14 23:49:46,reddit
1qd3ltd,Republicans reverse course on war powers vote and give Trump unchecked authority in Venezuela,PolloConTeriyaki,2026-01-14 23:49:35,reddit
1qd3gus,Senate blocks measure to restrict Venezuela strikes after Trump flips two Republicans,Zipper222222,2026-01-14 23:43:51,reddit
1qd3ah1,"Senate GOP kills war powers effort to limit Trump on Venezuela, with Vance breaking tie",joe13pr,2026-01-14 23:36:43,reddit
1qd3923,Some Democrats fume as Kristi Noem impeachment gains steam,RosetteNewcomb,2026-01-14 23:35:13,reddit
1qd35u0,"Trump says no critical minerals tariffs for now, will seek overseas supplies",consulent-finanziar,2026-01-14 23:31:34,reddit
1qd322o,Attacking Iran Is No Way to Support Iranian Protests — Trump’s military threats only embolden Iran’s leaders to crack down. The best way to support protestors is through diplomacy.,inthesetimesmag,2026-01-14 23:27:18,reddit
1qd2o8c,Trump says ‘anything less’ than US control of Greenland is ‘unacceptable’,Doener23,2026-01-14 23:11:56,reddit
1qd2mfd,ICE’s Violence Is “By Design” Under Trump,Rock-n-roll-Kevin,2026-01-14 23:09:56,reddit
1qd2lpx,ICE’s Secret Programs to Spy on All of Us Exposed,Ok_Employer7837,2026-01-14 23:09:11,reddit
1qd2jy2,"GOP lawmaker said trans people “harm” children. Now he's going to prison for child porn. He was caught sharing hundreds of images of kids, including pictures of adults raping seven-year-olds.",southpawFA,2026-01-14 23:07:12,reddit
1qd2fvo,Republican congressman blasts Trump's Greenland invasion talk as 'one of the dumbest things' that could wreck NATO,AndroidOne1,2026-01-14 23:02:41,reddit
1qd2bni,"Denmark, Greenland failed to win the Trump team over",Mysterious-Abies4310,2026-01-14 22:58:15,reddit
1qd27vl,Tech Workers Are Condemning ICE Even as Their CEOs Stay Quiet,wiredmagazine,2026-01-14 22:53:55,reddit
1qd1yhc,Josh Hawley Asked “Can Men Get Pregnant?” 11 Times at Abortion Hearing,Aranarth,2026-01-14 22:43:22,reddit
1qd1yad,“ICE Is OK with Renee Good’s Killing”: Journalist Ken Klippenstein on ICE Tactics &amp; Recruitment,ZuP,2026-01-14 22:43:08,reddit
1qd1wsd,The full list of 75 countries where Trump is suspending visa processing,nirliptota,2026-01-14 22:41:33,reddit
1qd1rg9,America Needs a Renee Good Civil Rights Act,AngelaMotorman,2026-01-14 22:35:48,reddit
1qd1g30,House Republicans say they will hold Hillary Clinton in contempt of Congress in Epstein inquiry,invertedspheres,2026-01-14 22:23:35,reddit
1qd1fw8,Denmark says there's a 'fundamental disagreement' with Trump over Greenland,copaceticthoughts,2026-01-14 22:23:24,reddit
1qd1fpo,ICE Is Waging War on Blue Cities,rezwenn,2026-01-14 22:23:11,reddit
1qd1a0o,House passes bill to codify Trump order on showerhead regulations,Old_Spice_2023,2026-01-14 22:16:55,reddit
1qd159x,Mayor Mamdani and AOC Condemn Chants Supporting Hamas at NY anti-Israel Protest,aslan_is_on_the_move,2026-01-14 22:11:51,reddit
1qd1061,Does Congress Even Want Power Anymore?,ChiGuy6124,2026-01-14 22:06:14,reddit
1qd0u1x,Trump claims killing of Iran protesters 'has stopped' even as Tehran signals executions ahead,Bigmacman_,2026-01-14 21:59:53,reddit
1qd0tdm,"After Sowing Distrust in Fluoridated Water, Kennedy and Skeptics Turn to Obstructing Other Fluoride Sources",kootles10,2026-01-14 21:59:09,reddit
1qd08f6,Trump Is Risking a Global Catastrophe,nimicdoareu,2026-01-14 21:36:39,reddit
1qd03or,"Prosecutors Flee DOJ After Being Told To Investigate The Murdered Woman, Not The Murderer",StraightedgexLiberal,2026-01-14 21:31:41,reddit
1qd035z,"Lindsey Graham Testified After 2020 Election That if You Told Trump 'Martians Came and Stole Votes,' He'd Believe It: “Graham and other Republicans expressed alarm over the president's efforts to overturn the election while testifying for a secret grand jury in 2022”",T_Shurt,2026-01-14 21:31:05,reddit
1qd02jh,Democrat Mary Peltola Edges Out Incumbent Republican in Alaska Senate Poll,unital_subalgebra,2026-01-14 21:30:26,reddit
1qczvzl,Kitchen countertop workers are dying. Some lawmakers want to ban their lawsuits,Hrmbee,2026-01-14 21:23:29,reddit
1qczslg,Donald Trump won't rule out leaving NATO over Greenland,Crossstoney,2026-01-14 21:19:59,reddit
1qczrdk,ICE Agents Reportedly Asking Minnesotans Where the Asians Are | Federal immigration agents are trying to get Minnesota residents to racially profile their neighbors for deportation.,thenewrepublic,2026-01-14 21:18:39,reddit
1qczk3n,Trump administration slashes grants for mental health and addiction treatment programs,alittlelessconvo,2026-01-14 21:11:01,reddit
1qczk3f,The many lies of Marco Rubio,PM_ME_DPRK_CANDIDS,2026-01-14 21:11:01,reddit
1qczbxa,US suspending immigrant visa processing for 75 countries,TheJewishMerp,2026-01-14 21:02:31,reddit
